Question,Answer
"In the provided {image_type} scan, where can the tumour be observed?",The tumour can be observed in the {position_description} area of the image.
Specify the tumour’s location in this {image_type} view.,The tumour is clearly seen in the {position_description} region.
Can you detect where the tumour is in this {image_type}?,The tumour is present in the {position_description} area.
Which area of the {image_type} shows a tumour?,The tumour is seen in the {position_description}.
"From this {image_type} scan, what is the tumour’s location?",The tumour is located in the {position_description} part.
Could you point out where the tumour is located in this {image_type} scan?,The tumour can be observed in the {position_description} area of the {image_type} scan.
What part of the body does the tumour appear in this {image_type} medical image?,"In this {image_type} image, the tumour is found in the {position_description} section."
Identify the region in this {image_type} image that shows the tumour.,The region showing the tumour in this {image_type} image is the {position_description}.
Can you specify the tumour’s location based on the {image_type} image provided?,"Based on the provided {image_type} image, the tumour lies in the {position_description} region."
"From this {image_type} image, where would you say the tumour is located?","Judging from the {image_type} image, the tumour is located at the {position_description}."
Could you specify the tumour’s location in this {image_type} scan?,The tumour is clearly located in the {position_description} area.
What region of this {image_type} shows the presence of a tumour?,The tumour is seen in the {position_description} region.
Where in the anatomical image ({image_type}) is the tumour located?,It is present in the {position_description} portion of the anatomy.
"Is there a visible tumour in the {image_type} image, and where?","Yes, it is found in the {position_description} area."
In which region of the {image_type} can the tumour be found?,The tumour can be found in the {position_description}.
Pinpoint the tumour location in this {image_type} scan.,It is located in the {position_description} region.
Which part of the {image_type} image contains the tumour?,The tumour is contained in the {position_description} part.
"In this {image_type} image, what is the tumour’s anatomical position?",The anatomical position of the tumour is {position_description}.
Identify the segment of this {image_type} that has a tumour.,The segment is {position_description}.
Where is the abnormal mass located in this {image_type} scan?,The abnormal mass appears in the {position_description}.
Can you detect the tumour’s placement in the {image_type} image?,The placement is in the {position_description} zone.
"Is the tumour visible in this {image_type}, and where is it found?","Yes, it is located in the {position_description} portion."
Which anatomical zone in the {image_type} image shows a tumour?,It is visible in the {position_description} region.
Where does the tumour appear in this {image_type} scan?,It appears in the {position_description} region of the scan.
Indicate the region where the tumour is located in this {image_type}.,The region is the {position_description}.
"In this scan of {image_type}, where do you see the tumour?",The tumour is seen in the {position_description} area.
What area in the {image_type} image reveals the tumour?,The area is {position_description}.
"According to this {image_type} image, where is the tumour found?",It is found in the {position_description}.
What is the approximate tumour position in this {image_type}?,"Approximately, it lies in the {position_description}."
Give the precise tumour location in this {image_type} image.,It is precisely located in the {position_description}.
Can the tumour be located in the upper or lower part of the {image_type}?,It is found in the {position_description} section.
Which side of the {image_type} contains the tumour?,The tumour is on the {position_description} side.
"In this {image_type} scan, which quadrant has the tumour?",The {position_description} quadrant contains the tumour.
What part of the {image_type} is affected by the tumour?,The {position_description} part is affected.
Where is the main tumour mass observed in this {image_type}?,It is observed in the {position_description} region.
Describe the tumour’s spatial location in this {image_type} scan.,The spatial location corresponds to the {position_description}.
Where is the suspicious mass situated in this {image_type}?,It is situated at the {position_description}.
Which image region shows the most tumour density in this {image_type}?,The region with most density is the {position_description}.
Can you tell which section of the image highlights the tumour?,The highlighted tumour appears in the {position_description} section.
"In this {image_type} medical scan, where can the tumour be localized?",It can be localized in the {position_description} area.
Where is the focal point of the tumour in this {image_type}?,The focal point is at the {position_description}.
Which directional area of the {image_type} shows the tumour?,The tumour shows up in the {position_description} direction.
Can you indicate the approximate region where the tumour lies?,It lies approximately in the {position_description}.
Where would you mark the tumour in this {image_type}?,I would mark the tumour in the {position_description}.
"In this view of the {image_type}, what part contains the tumour?",The tumour is in the {position_description} view.
What’s the visible tumour location in the {image_type} image?,"Visibly, it is in the {position_description}."
"According to the image, where does the tumour appear?",It appears in the {position_description} area.
"From the given {image_type}, where can we see the tumour?",It is seen in the {position_description} region.
What is the rough location of the tumour in the image?,"Roughly, the tumour is at the {position_description}."
Could you highlight the tumour’s location in this {image_type} image?,The tumour is highlighted in the {position_description} region.
